{
  "status": "source_authored_local_contract_results_not_science_accepted",
  "baseline_precondition": {
    "path": "geological_agent/geology/collection_contracts.py",
    "sha256_before": "25f805cf5531ff8bf1f8894f006dca40c6035efd44967507583c820dcc323fa9",
    "sha256_after": "53e762929334bb3f6c10a40b65dd098684845a38bf9801652f79f063745720a3"
  },
  "files": [
    {
      "path": "geological_agent/geology/collection_contracts.py",
      "sha256": "53e762929334bb3f6c10a40b65dd098684845a38bf9801652f79f063745720a3",
      "bytes": 9404
    },
    {
      "path": "geological_agent/geology/isolated_cpu_bridge_v2.py",
      "sha256": "1389987925d451fe45facb884a3e3beeb6d54e3400161bff8691ce8be5c988e6",
      "bytes": 43089
    },
    {
      "path": "geological_agent/geology/isolated_cpu_worker_v2.py",
      "sha256": "09032aa3448651b9f7aaca1796fa0a8cd943d5aa471e765f0a2e410f14e54125",
      "bytes": 8950
    },
    {
      "path": "tests/test_isolated_cpu_bridge_v2.py",
      "sha256": "2f629084d67e46c5bd457f4a0d53aec28d15243297fdf07fd1800df6953d3abb",
      "bytes": 23034
    },
    {
      "path": "catalog/source_delivery/expansion501-20261026/shared-isolation-v2/profiles.json",
      "sha256": "8e95ab7c0e26cdd66f00c89adf7b79ea4d7e11a78f6ef69f4c4770ee902781a0",
      "bytes": 63
    },
    {
      "path": "catalog/source_delivery/expansion501-20261026/shared-isolation-v2/profile.schema.json",
      "sha256": "b609df32d0261eb6b3283454acfe7d42ae552f6f80473885076ea471062eef3b",
      "bytes": 10454
    },
    {
      "path": "catalog/source_delivery/expansion501-20261026/shared-isolation-v2/source-package.schema.json",
      "sha256": "8f743560fdbe2a537b8fc693eea9a3d9f55e6115bf4824af613cc8709161ff96",
      "bytes": 2302
    },
    {
      "path": "catalog/source_delivery/expansion501-20261026/shared-isolation-v2/baseline-precondition.json",
      "sha256": "ed8692bbed97141662088e4dfe909e59d3ba0affe5b97b3657811e8d5d31833b",
      "bytes": 269
    },
    {
      "path": "catalog/source_delivery/expansion501-20261026/shared-isolation-v2/README.md",
      "sha256": "88ce2a114dd069869cad7f2c9c1bf80be1f8414c829efc7bf7fad774d2338021",
      "bytes": 6669
    },
    {
      "path": "catalog/source_delivery/expansion501-20261026/shared-isolation-v2/run_local_contracts.py",
      "sha256": "b1a691efcd6d15757cd34804de0c5f178cbc2d7d423a6836dcec7ec2db5299ca",
      "bytes": 3708
    },
    {
      "path": "catalog/source_delivery/expansion501-20261026/shared-isolation-v2/delivery-files.json",
      "sha256": "8602cc5eca1bc421d2d99d6d43ce24d5265bde11c0bc20dca468d11dda7baa04",
      "bytes": 1287
    },
    {
      "path": "catalog/source_delivery/expansion501-20261026/shared-isolation-v2/local-test-report-r1.json",
      "sha256": "7d8ac9f6cfec038323aee47e94ebfc9b1d69302c5daa379fd56600d2da39358e",
      "bytes": 5437
    },
    {
      "path": "catalog/source_delivery/expansion501-20261026/shared-isolation-v2/local-tests-r1.stdout.log",
      "sha256": "c502d3ca7dcd502044f454f3fd95b64387c8d9b65802096916d1f9ec5b35fbf6",
      "bytes": 4263
    },
    {
      "path": "catalog/source_delivery/expansion501-20261026/shared-isolation-v2/local-tests-r1.stderr.log",
      "sha256": "e3b0c44298fc1c149afbf4c8996fb92427ae41e4649b934ca495991b7852b855",
      "bytes": 0
    }
  ],
  "test_report": "catalog/source_delivery/expansion501-20261026/shared-isolation-v2/local-test-report-r1.json",
  "test_exit_code": 0,
  "science_acceptance": "not_run",
  "real_gpr_cross_interpreter": "not_run",
  "deployed": false,
  "submitted": false,
  "manifest_self_hash_excluded": true
}